{
  "formatVersion": 1,
  "id": "instaloader",
  "type": "library",
  "status": "active",
  "environments": [
    "dev"
  ],
  "executableSources": [],
  "inputs": {
    "build": [],
    "runtime": [
      "dependencies/instaloader/Dockerfile",
      "dependencies/instaloader/requirements.txt",
      "dependencies/instaloader/compose.yml"
    ],
    "checks": []
  },
  "dependencies": [],
  "commands": {
    "build": null,
    "check": null
  },
  "delivery": {
    "kind": "ready-files",
    "files": [
      "dependencies/instaloader/compose.yml",
      "dependencies/instaloader/requirements.txt"
    ],
    "entrypoints": [],
    "smokeImports": [],
    "systemRequirements": [
      "External OCI image brai-instaloader:4.15.3 built by its operator from Dockerfile and pinned requirements.txt; not installed or bundled by this app pipeline",
      "Python3.13 and Instaloader4.15.3 owned by that external image; network-free --help can run once image is available"
    ],
    "command": [
      "instaloader"
    ]
  },
  "deploy": {
    "units": [
      "instaloader"
    ],
    "migrations": [],
    "health": null
  },
  "npm": {
    "workspaces": []
  },
  "reason": "Pinned recipe and configuration for an external on-demand CLI; no first-party executable or installed runtime is delivered"
}
